{
  "schema_version": 1,
  "id": "qwen3vl-gguf-cpu",
  "runtime": "gguf",
  "backend": "cpu",
  "model": {
    "kind": "chat",
    "filename": "Qwen3-VL-2B-Instruct-Q8_0.gguf",
    "revision": "ea6a11058182570be6436b9a2e4ee7f7b49f908d",
    "url": "https://huggingface.co/ggml-org/Qwen3-VL-2B-Instruct-GGUF/resolve/ea6a11058182570be6436b9a2e4ee7f7b49f908d/Qwen3-VL-2B-Instruct-Q8_0.gguf",
    "sha256": "b7802e29f71a9e5b5e3f83f613df898a2204342dcea71a231ea501d481813c39",
    "bytes": 1834427296
  },
  "projector": {
    "filename": "mmproj-Qwen3-VL-2B-Instruct-Q8_0.gguf",
    "revision": "ea6a11058182570be6436b9a2e4ee7f7b49f908d",
    "url": "https://huggingface.co/ggml-org/Qwen3-VL-2B-Instruct-GGUF/resolve/ea6a11058182570be6436b9a2e4ee7f7b49f908d/mmproj-Qwen3-VL-2B-Instruct-Q8_0.gguf",
    "sha256": "69066c8f279ec85ff48ab4059f6ebba0d2932ca57667f2bbdac7d9805bca9e7b",
    "bytes": 445053056
  },
  "selection": "focused",
  "focus_features": [
    "tool_result_media"
  ],
  "context_size": 4096,
  "threads": 4,
  "max_tokens": 32,
  "enable_thinking": false
}
